{
  "event_id": "demo-duplicate-event-001",
  "order_id": "ORD-1003",
  "signal": "package is missing in transit and replacement inventory is available",
  "requested_outcome": "create the replacement exactly once when this identical event is delivered twice",
  "requested_option_id": "same-sku-replacement",
  "decision_time": "2026-08-20T18:00:00Z"
}
